{
  "schema_version": "1.0",
  "artifact": {"identifier": "synthetic.elf", "sha256": null, "type": "ELF64", "platform": "Linux", "architecture": "x86_64", "provenance": "safe synthetic metadata fixture"},
  "scope": {"authorized_objective": "Validate ELF evidence-report routing", "environment": "metadata-only CI fixture", "non_goals": ["runtime execution"]},
  "findings": [{"id": "ELF-001", "summary": "Dependency metadata requires static interpretation before runtime claims.", "confidence": "confirmed", "evidence": [{"kind": "metadata", "source": "fixtures/re/elf.sample.json", "tool": null, "tool_version": null, "command_or_method": "synthetic fixture validation"}]}],
  "evidence_state": "VERIFIED",
  "limitations": ["No executable bytes are present."],
  "next_evidence_step": null
}
